"2010","ديسمبر","8"," لم يستطع المشاهد العادي ادراك المغزي من وجودها فهي علي الورق قناة عامة اطلقتها شركة فيرجينيا للإنتاج الفني والاعلامي من خلال تأجيرها لأحد الأستوديهات الخاصة بالشركة المصرية لمدينة الإنتاج الإعلامي( أستديو10 بمجمع هـ الاعلامي)
إلا أن واقع البرامج اليومية للقناة كان لايمت للعمومية بصلة ابرزها انها اتجهت مباشرة في بعض من برامجها وافلامها لمخاطبة من هم فوق من18 سنة بدعوي انها تقدم اعمالا للكبار فقط في افلام ومسلسلات تتضمن لقطات والفاظا خليعة تنافي قيم المجتمع الي جانب برامج تروج للدجل والشعوذة ابرزها استضافة من يوهم الناس بقدرته علي معرفه احوال المتصلين بمجرد ذكرهم للاسم+ تاريخ الميلاد الي جانب برامج اخري تستخف بعقول المشاهدين بمحتواها الفقير جدا ثقافيا, ناهيك عن تدني الاداء المهني لفريق من العاملين بها حتي صار بعض من المشاهدين يتابعونها بغرض التندر بافيهات مذيعها لاسيما في طريقة نطقهم للمصطلحات الاجنبية ومخارج الحروف باللغة العربية فكان المشاهد يسمع عبارات يتم من خلالها نصب الخبر وجر المفعول به!
واستمرت القناة علي تلك الحالة الي ان شاركت كغيرها من القنوات الفضائية في تغطية الانتخابات البرلمانية الاخيرة.. ومعها لم يكن غريبا ان تجد من المشاهدين من يقفز عاليا وهو يصرخ وجدتها.. في اشارة الي انة تمكن اخيرا من معرفة السبب الذي من اجلة تم انشاء تلك القناة وانفاق الملايين عليها طوال السنوات الماضية وهي انها وسيلة دعاية اعلامية ليل نهار لصاحبها رجل الاعمال توفيق عكاشة الذي سخر كل امكانيات القناة طوال المعركة الانتخابية لمساندتة حتي فاز اخيرا بمقعد في البرلمان علي حساب منافسيه في دائرة نبروة.
وخالفت القناة في سبيل ذلك كل المعايير الاعلامية وهي حسب ماجاء في تقرير الجنة العليا للانتخابات برئاسة المستشار السيد عبدالعزيز عمر, كالاتي: ظهور مالك القناة توفيق عكاشة الذي هو أحد المرشحين للانتخابات بشكل مستمر علي شاشة القناة بما يعد مخالفة لأحد مبادئ التغطية بحظر ظهور المذيعين ومقدمي البرامج بعد بدء الحملات الإنتخابية.
كما دابت الفراعين علي عمل برومهات دعاية إنتخابية مباشرة لتوفيق عكاشة, الي جانب تغطية لمؤتمراته الشعبيه دون إشارة للمرشحين الآخرين بدائرته, وهناك مخالفات اخري جسيمة ابرزها عندما أعلنت القناة عن فوز توفيق عكاشة في الإنتخابات وذلك قبل3 ايام من موعد التصويت!
ومع تكرار المخالفات الصارخة و تجاهل الفراعين لثلاثه انذارت من المنطقة الحرة الإعلامية التابعة للهيئة العامة للاستثمار مما دفع بالمنطقة الي قطع اشارة البث عنها في منتصف ليل يوم الجمعة الماضي ولمدة أسبوعين.
 
 ","
                                                                            الفراعين‏..‏ فضائية افسدتها الانتخابات‏!‏
                                                                            كتب‏-‏ محمد عبدالحميد شحاتة‏:‏ 
                                                                        ","Ahram","http:__www.ahram.org.eg_archive_news_Air-supplement_News_52229.aspx"
"2010","ديسمبر","22","بعد أن طلبت محكمة القضاء الإداري إعلان كل من شيخ الأزهر ومفتي الجمهورية ومدير عام مجمع البحوث الإسلامية للحضور أمامها للرد علي الدعوي التي رفعها بعض المحامين, الذين طالبوا بوقف عرض المسلسل سواء علي قناة ميلودي للدراما أو أي قناة من القنوات الفضائية, مؤكدين في دعوتهم أن مسلسل يوسف الصديق يجسد شخصية نبي الله يعقوب والنبي يوسف وهذا التجسيد مخالف لجميع الفتاوي التي أصدرها مجمع البحوث الإسلامية والأزهر الشريف والتي حرمت تجسيد وتمثيل شخصيات الأنبياء والرسل والملائكة لأن تقمص الممثلين صورهم بأشكال متعددة ثم يثار الجدل ومناقشة حول هذه الشخصية سواء من أهل الفن أو المسرح والنقاد وهذا لا يجوز.
مسلسل يوسف الصديق عرض علي الفضائيات منذ إنتاجه عام2008, وهو مسلسل تاريخي إيراني يحكي في45 حلقة قصة نبي الله يوسف عليه السلام, وشارك في كتابة السيناريو20 شخصا.","
                                                                            استمرار دعوي إيقاف يوسف الصديق
                                                                            ","Ahram","http:__www.ahram.org.eg_archive_news_Air-supplement_News_54474.aspx"
"2010","ديسمبر","1","وقال بيان صدر اليوم عن الهيئة انه سيعقد غدا الخميس مؤتمر صحفي لاعلان قرار الانسحاب بحضور السيد البدوى رئيس الحزب وقيادات واعضاء ورموز الحزب.
وفى الوقت نفسه صرح فؤاد بدراوى نائب رئيس الحزب بان انسحاب الوفد من انتخابات الاعادة ليس نهائيا.","
                                                                            انسحاب الوفد من انتخابات الإعادة 
                                                                            ","Ahram","http:__www.ahram.org.eg_archive_news_Al-Ahram-Files_News_51117.aspx"
"2010","ديسمبر","14","جاء الاحتفال تعبيراً من أعضاء مجلس النقابة عن تقديرهم للجهود التى قام بها نقيبهم خلال رئاسته للجنة الصحة بمجلس الشعب، والتى من خلالها ساهم فى صدور قوانين الصحة التى تمس المواطنين والأطباء.
وقال الدكتور حمدى السيد خلال الاحتفال أنه حزين لعدم استكماله مشروعات قوانين الصحة التى تمس المواطنين والأطباء على حد سواء، وأضاف أنه لن يسكت وسيستمر فى الدفاع عن قضايا الأمة والوطن، كما أكد أنه سيفضح المزورين وسيواصل النضال خارج قبة البرلمان لمصلحة جموع الناس وليس الأطباء فقط.
جاء الاحتفال بدعوة من الدكتور أسامة رسلان الأمين العام لنقابة الأطباء بحضور الدكاترة شوقى الحداد وكيل النقابة وعصام العريان وأحمد عمر وسيد هيكل وسعد الفتيانى.","
                                                                            السيد حزين لعدم استكماله قوانين الصحة
                                                                            كتب - هانى فتحى:
                                                                        ","Ahram","http:__www.ahram.org.eg_archive_news_Al-Ahram-Files_News_53177.aspx"
